tune_results_ver3/logs/tune_results.csv
batch_size,next_n,heads,index_dim,avg_kv_length,var_ratio,deepgemm_us,moreh_us,speedup,top_configs,num_warp,chunkK,splitK
1,1,32,128,65536,0.00390625,8.6,11.2,0.766,"[(2, 64, -1, 11), (8, 128, 376, 11), (8, 128, 280, 11), (8, 128, 328, 11), (8, 128, 456, 11), (8, 128, 400, 11), (8, 128, 440, 11), (4, 128, 488, 11), (8, 128, 472, 11), (8, 128, 264, 11)]",,,
1,2,32,128,65536,0.00390625,12.6,14.9,0.848,"[(4, 64, 456, 14), (4, 64, 448, 14), (4, 64, 440, 14), (4, 64, 320, 15), (4, 128, 376, 15), (4, 128, 368, 15), (4, 128, 400, 15), (4, 128, 360, 15), (4, 64, 312, 15), (4, 128, 384, 15)]",,,
2,1,32,128,65536,0.00390625,14.3,12.0,1.197,"[(8, 256, 144, 11), (8, 128, 208, 13), (8, 128, 200, 13), (8, 128, 224, 13), (8, 128, 216, 14), (8, 256, 256, 14), (8, 256, 248, 14), (4, 64, 760, 15), (4, 64, 888, 15), (8, 256, 224, 15)]",,,
2,2,32,128,65536,0.00390625,30.6,23.2,1.318,"[(8, 64, 216, 23), (8, 64, 200, 23), (2, 64, 312, 23), (2, 64, 336, 23), (8, 64, 192, 23), (2, 64, 304, 23), (2, 64, -1, 24), (4, 64, 896, 24), (4, 64, 872, 24), (4, 64, 720, 24)]",,,
3,1,32,128,65536,0.00390625,27.3,19.3,1.413,"[(8, 64, 88, 19), (8, 128, 240, 19), (8, 64, 120, 19), (8, 64, 80, 20), (8, 128, 176, 20), (8, 128, 184, 20), (8, 128, 168, 20), (2, 64, -1, 20), (8, 128, 208, 20), (8, 64, 104, 20)]",,,
3,2,32,128,65536,0.00390625,46.7,31.3,1.489,"[(2, 64, -1, 31), (4, 64, 896, 32), (4, 64, 920, 32), (4, 64, 720, 32), (4, 64, 936, 32), (8, 128, -1, 33), (8, 128, 88, 33), (4, 64, 136, 33), (8, 64, -1, 33), (4, 64, -1, 33)]",,,
4,1,32,128,65536,0.00390625,32.1,23.0,1.393,"[(4, 128, 160, 23), (4, 128, -1, 23), (4, 128, 152, 23), (4, 128, 136, 24), (4, 128, 128, 24), (2, 64, -1, 24), (4, 64, 168, 26), (4, 64, 248, 26), (4, 64, 136, 26), (8, 128, 208, 26)]",,,
4,2,32,128,65536,0.00390625,58.5,38.3,1.527,"[(2, 64, -1, 38), (4, 64, 944, 38), (4, 64, 784, 39), (4, 64, 952, 39), (4, 64, 768, 39), (4, 64, 984, 39), (8, 64, 72, 39), (4, 64, 112, 39), (4, 64, 776, 39), (4, 64, 72, 39)]",,,
5,1,32,128,65536,0.00390625,43.3,25.1,1.722,"[(8, 64, 104, 25), (4, 64, 216, 25), (4, 64, 224, 25), (4, 64, 248, 25), (8, 64, 256, 26), (8, 64, 248, 26), (8, 128, 96, 26), (8, 128, 88, 26), (8, 64, 96, 27), (8, 128, 120, 27)]",,,
5,2,32,128,65536,0.00390625,70.2,40.4,1.738,"[(2, 64, 104, 40), (2, 64, 112, 40), (2, 64, 88, 41), (2, 64, 80, 41), (4, 64, -1, 42), (8, 128, -1, 42), (8, 64, -1, 43), (8, 128, 64, 43), (4, 64, 56, 43), (2, 64, 96, 43)]",,,
6,1,32,128,65536,0.00390625,41.9,31.0,1.353,"[(8, 128, 72, 30), (2, 64, -1, 31), (8, 64, 96, 33), (8, 64, 448, 33), (8, 64, 392, 33), (8, 64, 456, 33), (8, 64, 408, 33), (4, 64, -1, 33), (8, 64, 416, 33), (8, 64, 400, 33)]",,,
6,2,32,128,65536,0.00390625,80.5,51.5,1.562,"[(2, 64, -1, 51), (4, 64, -1, 51), (4, 64, 64, 52), (4, 64, 48, 52), (8, 64, 48, 52), (2, 64, 72, 52), (8, 64, -1, 52), (4, 64, 72, 52), (8, 64, 64, 53), (2, 64, 96, 53)]",,,
7,1,32,128,65536,0.00390625,46.7,34.1,1.372,"[(4, 128, 72, 34), (4, 64, 320, 34), (4, 64, 304, 34), (4, 64, 312, 34), (2, 64, -1, 34), (4, 64, 464, 35), (4, 64, 496, 35), (4, 64, 80, 35), (4, 64, 472, 35), (8, 128, 240, 35)]",,,
7,2,32,128,65536,0.00390625,91.5,53.0,1.726,"[(4, 64, 248, 53), (8, 128, 40, 53), (4, 128, 40, 53), (4, 64, 72, 53), (8, 128, 104, 54), (4, 64, 56, 54), (4, 64, 304, 55), (4, 64, 120, 55), (8, 64, 40, 55), (4, 64, 128, 55)]",,,
8,1,32,128,65536,0.00390625,55.3,35.4,1.561,"[(4, 64, 96, 35), (4, 64, 72, 35), (4, 64, 240, 38), (2, 64, -1, 38), (8, 64, 328, 38), (4, 64, 664, 39), (8, 64, 312, 39), (4, 64, 800, 39), (4, 64, 784, 39), (8, 64, 296, 39)]",,,
8,2,32,128,65536,0.00390625,100.5,46.1,2.178,"[(4, 64, 72, 46), (4, 64, 64, 46), (4, 64, 56, 46), (8, 128, 32, 47), (4, 64, 48, 49), (8, 64, 72, 49), (8, 64, 56, 50), (8, 64, 48, 50), (2, 64, 72, 50), (4, 64, 144, 50)]",,,
9,1,32,128,65536,0.00390625,60.7,33.2,1.831,"[(8, 128, 64, 33), (4, 128, 64, 34), (8, 64, 56, 37), (4, 64, 56, 38), (4, 64, 168, 39), (4, 64, 152, 39), (4, 64, 160, 40), (2, 128, 64, 40), (8, 64, 152, 41), (8, 64, 160, 41)]",,,
9,2,32,128,65536,0.00390625,135.7,63.7,2.129,"[(8, 128, 24, 63), (4, 64, 248, 64), (4, 64, 216, 64), (4, 64, 208, 64), (4, 64, 256, 64), (4, 64, 240, 65), (4, 64, 232, 65), (4, 64, 120, 65), (4, 64, 224, 65), (4, 128, 24, 66)]",,,
10,1,32,128,65536,0.00390625,64.8,41.7,1.553,"[(8, 256, 32, 41), (8, 128, 32, 42), (4, 64, 48, 43), (8, 128, 56, 43), (8, 64, 56, 43), (4, 128, 56, 43), (4, 64, 152, 44), (4, 64, 56, 44), (4, 64, 184, 44), (4, 64, 168, 44)]",,,
10,2,32,128,65536,0.00390625,110.9,67.6,1.639,"[(4, 128, -1, 67), (8, 128, -1, 70), (4, 64, 40, 71), (4, 128, 64, 72), (2, 64, 40, 72), (8, 128, 56, 73), (8, 128, 24, 73), (4, 64, 192, 73), (4, 128, 24, 73), (4, 64, 200, 73)]",,,
11,1,32,128,65536,0.00390625,74.2,42.3,1.754,"[(4, 64, 80, 42), (4, 64, 192, 42), (4, 64, 176, 43), (4, 64, 200, 43), (4, 64, 184, 43), (8, 64, 80, 43), (8, 128, 208, 44), (2, 64, 80, 44), (8, 128, 216, 45), (8, 64, 184, 46)]",,,
11,2,32,128,65536,0.00390625,165.5,66.8,2.479,"[(4, 64, 40, 66), (8, 64, 40, 67), (2, 64, 40, 72), (4, 64, 144, 73), (8, 128, 40, 74), (4, 64, 80, 74), (8, 128, 48, 75), (4, 64, 136, 75), (4, 64, 88, 76), (4, 64, 192, 76)]",,,
12,1,32,128,65536,0.00390625,81.7,51.6,1.583,"[(4, 64, -1, 51), (8, 64, -1, 52), (2, 64, -1, 52), (4, 64, 64, 52), (2, 64, 72, 52), (4, 64, 72, 52), (2, 64, 480, 52), (4, 64, 344, 52), (4, 64, 304, 52), (2, 64, 488, 53)]",,,
12,2,32,128,65536,0.00390625,166.4,87.0,1.914,"[(8, 64, 24, 86), (4, 64, 24, 87), (4, 64, 32, 87), (2, 64, -1, 87), (4, 64, -1, 87), (8, 64, -1, 87), (4, 64, 288, 88), (8, 64, 32, 89), (2, 64, 40, 89), (4, 64, 440, 89)]",,,
13,1,32,128,65536,0.00390625,87.6,48.4,1.81,"[(8, 128, 104, 48), (8, 128, 112, 48), (8, 128, 128, 48), (8, 128, 120, 48), (4, 64, 104, 49), (4, 64, 112, 49), (4, 64, 168, 49), (8, 128, 40, 49), (4, 64, 160, 50), (4, 64, 152, 50)]",,,
13,2,32,128,65536,0.00390625,176.0,81.4,2.163,"[(4, 64, 96, 81), (8, 64, 96, 84), (8, 128, 64, 87), (8, 128, 88, 89), (4, 128, 64, 89), (8, 128, 96, 89), (4, 64, 176, 91), (4, 64, 192, 91), (4, 64, 144, 91), (4, 64, 168, 91)]",,,
14,1,32,128,65536,0.00390625,92.2,44.7,2.063,"[(4, 128, 40, 44), (8, 128, 40, 45), (8, 64, 40, 45), (4, 64, 40, 48), (4, 64, 64, 49), (8, 128, 152, 51), (4, 64, 136, 52), (4, 64, 144, 52), (4, 64, 88, 53), (8, 64, 64, 53)]",,,
14,2,32,128,65536,0.00390625,169.7,88.3,1.922,"[(2, 64, 40, 88), (4, 64, 40, 88), (4, 128, 40, 90), (8, 128, 40, 91), (4, 64, 32, 91), (4, 64, 80, 91), (8, 64, 32, 93), (2, 64, 32, 93), (2, 64, 80, 93), (4, 128, -1, 95)]",,,
15,1,32,128,65536,0.00390625,92.1,50.4,1.828,"[(4, 64, 144, 50), (4, 64, 136, 50), (8, 64, 144, 53), (8, 64, 136, 53), (2, 64, 144, 53), (2, 64, 136, 53), (8, 256, -1, 53), (8, 256, 40, 53), (8, 128, 168, 56), (8, 128, 152, 56)]",,,
15,2,32,128,65536,0.00390625,179.1,80.0,2.239,"[(4, 64, 40, 79), (8, 64, 40, 82), (2, 64, 40, 83), (8, 128, 40, 85), (4, 128, 40, 86), (4, 64, 72, 95), (8, 128, 64, 97), (8, 128, 16, 97), (2, 64, 72, 98), (8, 64, 72, 98)]",,,
16,1,32,128,65536,0.00390625,99.8,64.2,1.556,"[(4, 64, 48, 64), (2, 64, 152, 65), (8, 128, 32, 65), (2, 64, -1, 65), (4, 64, 256, 65), (4, 64, 56, 65), (4, 64, 152, 65), (2, 64, 56, 65), (2, 64, 72, 66), (2, 64, 48, 66)]",,,
16,2,32,128,65536,0.00390625,211.6,77.1,2.744,"[(4, 64, 32, 77), (8, 64, 32, 77), (8, 128, 16, 77), (4, 64, 72, 79), (4, 64, 64, 80), (8, 64, 24, 80), (8, 64, 64, 81), (8, 128, 48, 81), (4, 64, 112, 82), (4, 64, 120, 82)]",,,
