tune_results_ver2/logs_pd4/tune_results.csv
batch_size,next_n,heads,index_dim,avg_kv_length,var_ratio,deepgemm_us,moreh_us,speedup,top_configs,num_warp,chunkK,splitK
1,1,32,128,65536,0.00390625,9.0,11.6,0.774,"[(2, 64, -1, 11), (8, 128, 280, 12), (8, 128, 416, 12), (8, 128, 480, 12), (8, 128, 368, 12), (8, 128, 464, 12), (8, 128, 288, 12), (8, 128, 456, 12), (2, 64, 944, 12), (4, 64, 632, 12)]",,,
1,2,32,128,65536,0.00390625,14.2,14.9,0.959,"[(8, 128, 392, 14), (8, 128, 368, 14), (8, 128, 344, 14), (8, 128, 360, 14), (8, 128, 336, 14), (8, 128, 168, 15), (8, 128, 160, 15), (8, 128, 184, 16), (8, 128, 264, 16), (8, 128, 416, 16)]",,,
2,1,32,128,65536,0.00390625,13.1,16.5,0.792,"[(8, 128, -1, 16), (8, 128, 336, 16), (8, 128, 392, 16), (8, 128, 312, 16), (8, 128, 360, 16), (8, 128, 416, 16), (8, 128, 304, 16), (8, 128, 320, 16), (8, 128, 440, 16), (8, 128, 464, 16)]",,,
2,2,32,128,65536,0.00390625,32.4,22.5,1.438,"[(8, 128, 168, 22), (8, 128, 160, 22), (4, 64, 160, 23), (4, 64, 168, 23), (4, 64, 136, 24), (4, 64, 120, 25), (4, 64, 128, 25), (4, 64, 112, 26), (4, 64, 104, 26), (4, 64, 216, 26)]",,,
3,1,32,128,65536,0.00390625,28.2,19.0,1.485,"[(4, 128, 208, 19), (4, 128, 224, 19), (4, 128, 216, 19), (8, 64, 304, 19), (8, 256, 104, 20), (8, 64, 440, 20), (8, 64, 408, 20), (8, 128, 256, 22), (8, 128, 224, 22), (8, 128, 248, 22)]",,,
3,2,32,128,65536,0.00390625,46.6,30.0,1.556,"[(8, 64, 152, 29), (8, 64, 160, 30), (8, 64, 192, 31), (8, 64, 176, 31), (8, 128, 96, 32), (4, 64, 128, 33), (4, 128, 88, 33), (8, 64, 136, 33), (8, 64, 144, 33), (4, 64, 96, 33)]",,,
4,1,32,128,65536,0.00390625,32.3,26.8,1.204,"[(4, 64, 240, 26), (8, 128, 144, 26), (4, 64, 208, 26), (8, 128, 152, 26), (8, 128, -1, 26), (4, 64, 232, 26), (4, 64, 152, 27), (4, 128, 288, 27), (4, 128, 264, 27), (8, 128, 168, 27)]",,,
4,2,32,128,65536,0.00390625,58.3,36.9,1.578,"[(4, 128, 72, 36), (4, 128, 64, 37), (4, 64, 120, 39), (8, 128, 72, 39), (8, 128, 80, 39), (4, 64, 136, 39), (4, 64, 144, 39), (4, 64, 104, 39), (4, 128, 80, 39), (4, 64, 96, 40)]",,,
5,1,32,128,65536,0.00390625,42.9,23.8,1.807,"[(8, 128, 112, 23), (8, 128, 128, 23), (8, 64, 104, 24), (8, 64, 128, 26), (8, 128, 96, 26), (8, 128, 88, 26), (4, 64, 224, 26), (4, 64, 216, 26), (4, 64, 232, 26), (8, 128, 120, 27)]",,,
5,2,32,128,65536,0.00390625,68.2,42.5,1.603,"[(8, 128, 64, 42), (8, 128, -1, 43), (8, 64, -1, 43), (4, 64, 112, 43), (8, 128, 48, 43), (4, 64, 104, 43), (4, 128, 64, 43), (4, 128, -1, 44), (8, 64, 112, 44), (2, 64, 104, 44)]",,,
6,1,32,128,65536,0.00390625,45.1,29.6,1.522,"[(8, 64, 144, 29), (8, 64, 136, 29), (8, 64, -1, 29), (8, 64, 152, 30), (8, 64, 176, 30), (4, 64, 928, 32), (4, 64, 912, 32), (4, 64, 904, 32), (8, 128, 88, 32), (4, 64, 160, 33)]",,,
6,2,32,128,65536,0.00390625,78.7,48.3,1.632,"[(2, 64, 96, 48), (2, 64, 88, 48), (2, 64, 80, 51), (4, 64, 96, 51), (4, 64, 88, 52), (8, 128, 40, 52), (8, 128, -1, 52), (4, 64, 64, 52), (4, 128, 48, 52), (4, 64, 72, 52)]",,,
7,1,32,128,65536,0.00390625,48.8,32.0,1.524,"[(8, 64, 144, 32), (4, 64, 192, 32), (4, 64, 184, 32), (4, 64, 200, 32), (8, 128, -1, 33), (8, 64, 200, 33), (4, 128, -1, 33), (8, 64, 176, 33), (8, 64, 160, 34), (8, 64, 168, 34)]",,,
7,2,32,128,65536,0.00390625,91.1,53.2,1.713,"[(4, 64, 72, 53), (8, 64, 72, 54), (4, 64, 128, 56), (4, 64, 64, 56), (8, 128, 88, 56), (8, 128, 40, 56), (8, 64, 64, 56), (4, 64, 80, 57), (8, 128, 112, 57), (4, 64, 160, 57)]",,,
8,1,32,128,65536,0.00390625,57.7,35.2,1.637,"[(8, 128, 80, 35), (4, 128, 80, 36), (4, 64, 104, 38), (8, 64, 272, 39), (8, 64, 264, 39), (8, 128, -1, 39), (4, 64, 120, 39), (4, 64, 256, 39), (4, 64, 248, 39), (8, 128, 72, 39)]",,,
8,2,32,128,65536,0.00390625,99.3,48.4,2.051,"[(4, 64, 72, 48), (8, 128, 32, 48), (4, 64, 56, 49), (8, 64, 56, 49), (4, 64, 144, 49), (4, 64, 64, 50), (8, 64, 72, 50), (4, 64, 168, 51), (4, 64, 152, 51), (8, 64, 48, 51)]",,,
9,1,32,128,65536,0.00390625,62.9,33.8,1.863,"[(8, 128, 64, 33), (4, 128, 64, 38), (4, 64, 112, 38), (4, 64, 104, 40), (8, 64, 112, 41), (8, 64, 64, 41), (8, 64, 104, 41), (4, 64, 88, 41), (4, 64, 96, 41), (8, 64, 160, 42)]",,,
9,2,32,128,65536,0.00390625,136.6,63.6,2.148,"[(8, 128, 24, 63), (8, 128, 56, 65), (8, 128, 32, 67), (4, 64, 136, 67), (4, 64, 144, 67), (4, 64, 48, 67), (4, 64, 304, 67), (4, 64, 64, 68), (8, 64, 144, 68), (8, 64, 120, 68)]",,,
10,1,32,128,65536,0.00390625,63.6,42.9,1.484,"[(8, 128, 56, 42), (4, 64, 96, 43), (8, 256, 32, 43), (4, 64, 88, 44), (4, 64, 128, 44), (8, 64, 96, 44), (4, 64, 120, 44), (4, 64, 248, 45), (4, 64, 72, 45), (4, 64, 104, 45)]",,,
10,2,32,128,65536,0.00390625,113.2,67.0,1.689,"[(8, 128, -1, 67), (4, 64, 40, 69), (8, 64, 40, 70), (4, 128, -1, 72), (8, 128, 24, 73), (4, 64, 48, 73), (8, 128, 56, 73), (8, 128, 64, 73), (8, 64, -1, 73), (4, 64, 120, 74)]",,,
11,1,32,128,65536,0.00390625,73.4,39.6,1.853,"[(4, 64, 80, 39), (8, 64, 80, 39), (4, 64, 176, 44), (4, 64, 200, 44), (4, 64, 192, 44), (4, 64, 184, 45), (2, 64, 96, 46), (8, 64, 192, 46), (8, 64, 176, 46), (8, 64, 184, 46)]",,,
11,2,32,128,65536,0.00390625,166.9,68.0,2.454,"[(4, 64, 40, 68), (8, 64, 40, 68), (8, 128, 40, 76), (4, 64, 80, 76), (8, 64, 144, 77), (8, 128, 48, 77), (8, 64, 80, 78), (8, 64, 136, 78), (4, 64, 136, 79), (4, 64, 144, 79)]",,,
12,1,32,128,65536,0.00390625,83.8,51.4,1.63,"[(4, 64, 64, 51), (8, 128, 48, 51), (8, 128, -1, 51), (4, 64, 96, 51), (2, 64, 96, 51), (4, 64, 72, 52), (8, 128, 40, 52), (8, 64, 72, 52), (4, 64, -1, 52), (4, 64, 88, 52)]",,,
12,2,32,128,65536,0.00390625,166.7,84.4,1.975,"[(8, 128, 24, 84), (4, 64, 40, 84), (4, 64, 48, 85), (4, 64, 32, 86), (4, 64, -1, 87), (8, 64, 32, 87), (8, 64, 24, 87), (4, 128, 24, 88), (4, 64, 96, 88), (8, 64, -1, 88)]",,,
13,1,32,128,65536,0.00390625,85.0,49.4,1.719,"[(8, 128, 104, 49), (8, 128, 112, 50), (8, 128, 120, 50), (8, 128, 128, 50), (4, 64, 152, 51), (8, 64, 112, 52), (8, 64, 104, 52), (4, 64, 176, 52), (4, 64, 192, 52), (8, 64, 48, 53)]",,,
13,2,32,128,65536,0.00390625,177.0,81.1,2.182,"[(8, 64, -1, 81), (4, 64, -1, 84), (4, 64, 96, 85), (8, 128, 64, 85), (8, 128, 56, 86), (8, 128, 48, 86), (8, 64, 112, 87), (4, 64, 112, 88), (8, 64, 104, 88), (8, 64, 96, 89)]",,,
14,1,32,128,65536,0.00390625,91.7,49.6,1.847,"[(8, 128, 40, 49), (8, 128, 88, 50), (4, 64, 88, 50), (8, 128, 96, 51), (8, 128, 72, 51), (8, 64, 88, 53), (4, 128, 40, 54), (8, 64, 40, 55), (4, 64, 56, 55), (4, 64, 80, 55)]",,,
14,2,32,128,65536,0.00390625,169.1,85.9,1.968,"[(4, 64, 40, 85), (8, 64, 40, 88), (8, 128, 40, 89), (4, 64, 32, 90), (8, 64, 32, 90), (8, 128, -1, 92), (4, 64, 80, 93), (4, 64, 88, 94), (4, 64, 72, 95), (8, 64, -1, 96)]",,,
15,1,32,128,65536,0.00390625,96.3,45.6,2.113,"[(4, 64, 80, 45), (8, 64, 80, 48), (2, 64, 80, 53), (4, 64, 136, 55), (8, 128, -1, 56), (8, 64, 144, 56), (8, 128, 40, 56), (4, 64, 144, 56), (8, 128, 32, 57), (4, 64, 56, 57)]",,,
15,2,32,128,65536,0.00390625,176.3,92.5,1.905,"[(8, 64, 24, 92), (8, 128, 40, 94), (4, 64, 72, 95), (8, 128, 64, 95), (8, 64, 72, 96), (4, 64, 24, 96), (4, 64, 128, 98), (4, 64, 120, 98), (8, 128, -1, 98), (4, 64, 112, 99)]",,,
16,1,32,128,65536,0.00390625,103.9,61.1,1.702,"[(4, 64, 48, 61), (8, 128, 32, 62), (4, 64, 72, 63), (4, 64, 40, 63), (8, 64, 56, 63), (4, 64, 56, 64), (8, 128, 80, 64), (8, 64, 48, 64), (4, 64, 160, 64), (4, 64, 136, 64)]",,,
16,2,32,128,65536,0.00390625,211.9,81.2,2.61,"[(8, 64, 32, 81), (8, 128, 16, 81), (4, 64, 32, 83), (4, 64, 72, 83), (8, 64, 72, 83), (8, 64, 64, 85), (4, 64, 120, 85), (8, 64, 24, 85), (4, 64, 64, 86), (4, 64, 112, 86)]",,,
