tune_results_ver7/logs2/tune_results_gpu7_top1.csv
batch_size,next_n,heads,index_dim,avg_kv_length,var_ratio,deepgemm_us,moreh_us,speedup,num_warp,chunkK,splitK
1,1,32,128,65536,0.00390625,10.2,10.4,0.98,2,64,-1
1,2,32,128,65536,0.00390625,14.5,14.9,0.97,2,64,-1
2,1,32,128,65536,0.00390625,12.1,14.8,0.818,8,256,200
2,2,32,128,65536,0.00390625,32.5,24.3,1.338,2,64,-1
3,1,32,128,65536,0.00390625,27.6,19.1,1.447,8,128,88
3,2,32,128,65536,0.00390625,46.4,31.2,1.488,2,64,-1
4,1,32,128,65536,0.00390625,31.1,22.3,1.391,8,128,-1
4,2,32,128,65536,0.00390625,58.1,37.8,1.537,4,64,432
5,1,32,128,65536,0.00390625,40.9,23.1,1.773,8,128,104
5,2,32,128,65536,0.00390625,70.5,42,1.679,8,128,64
6,1,32,128,65536,0.00390625,46.9,31.2,1.504,8,256,48
6,2,32,128,65536,0.00390625,82,50.8,1.614,2,64,-1
7,1,32,128,65536,0.00390625,46.8,32.9,1.422,8,256,48
7,2,32,128,65536,0.00390625,90.4,51.9,1.742,4,64,72
8,1,32,128,65536,0.00390625,59.6,38.1,1.565,2,64,-1
8,2,32,128,65536,0.00390625,101.1,47.1,2.147,4,64,72
9,1,32,128,65536,0.00390625,62.3,33.1,1.884,8,128,64
9,2,32,128,65536,0.00390625,137.4,59.8,2.297,8,128,24
10,1,32,128,65536,0.00390625,62.9,41.2,1.527,8,128,56
10,2,32,128,65536,0.00390625,114.2,69.4,1.646,4,64,-1
11,1,32,128,65536,0.00390625,72.3,37.3,1.938,4,64,80
11,2,32,128,65536,0.00390625,166.3,70.4,2.363,8,128,48
12,1,32,128,65536,0.00390625,77,49.9,1.541,4,64,168
12,2,32,128,65536,0.00390625,167.4,85.7,1.954,4,64,32
13,1,32,128,65536,0.00390625,81.2,48,1.693,8,128,112
13,2,32,128,65536,0.00390625,173.4,83,2.089,8,128,64
14,1,32,128,65536,0.00390625,90.3,43.2,2.092,4,128,40
14,2,32,128,65536,0.00390625,167.8,92.3,1.819,4,128,-1
15,1,32,128,65536,0.00390625,86.1,46.9,1.837,4,64,144
15,2,32,128,65536,0.00390625,176.4,86,2.05,8,128,40
16,1,32,128,65536,0.00390625,99.4,62.4,1.594,4,64,-1
16,2,32,128,65536,0.00390625,213.8,76.4,2.799,8,64,32
17,1,32,128,65536,0.00390625,131.6,51.4,2.561,8,128,64
17,2,32,128,65536,0.00390625,238,99.5,2.392,4,64,72
18,1,32,128,65536,0.00390625,134.7,62.4,2.159,4,64,40
18,2,32,128,65536,0.00390625,241.1,116.7,2.067,8,128,24
19,1,32,128,65536,0.00390625,135,58.1,2.324,4,64,184
19,2,32,128,65536,0.00390625,248,112,2.213,8,128,40
20,1,32,128,65536,0.00390625,121.2,65.6,1.847,4,64,32
20,2,32,128,65536,0.00390625,241.2,120.9,1.995,8,64,-1
21,1,32,128,65536,0.00390625,132.9,57.3,2.319,4,64,104
21,2,32,128,65536,0.00390625,255.3,125.6,2.032,8,128,64
22,1,32,128,65536,0.00390625,158.6,62.5,2.537,8,64,40
22,2,32,128,65536,0.00390625,257.6,134.7,1.912,4,128,24
23,1,32,128,65536,0.00390625,171.7,74.3,2.311,4,64,144
23,2,32,128,65536,0.00390625,284.7,125.7,2.266,8,128,24
24,1,32,128,65536,0.00390625,169,85.8,1.97,4,64,24
24,2,32,128,65536,0.00390625,278.4,103.5,2.689,4,64,24
25,1,32,128,65536,0.00390625,170.7,74.1,2.304,8,128,64
25,2,32,128,65536,0.00390625,305.6,137.5,2.223,8,128,24
26,1,32,128,65536,0.00390625,159.5,77.2,2.067,4,64,40
26,2,32,128,65536,0.00390625,309.7,152,2.038,2,64,40
27,1,32,128,65536,0.00390625,176.3,67.2,2.623,4,64,80
27,2,32,128,65536,0.00390625,318.5,150.9,2.111,2,64,40
28,1,32,128,65536,0.00390625,156.6,83.6,1.873,8,128,-1
28,2,32,128,65536,0.00390625,317.2,170.1,1.866,4,128,-1
29,1,32,128,65536,0.00390625,171,75.6,2.262,4,64,104
29,2,32,128,65536,0.00390625,326.6,177,1.846,4,64,16
30,1,32,128,65536,0.00390625,170.7,68.4,2.496,4,64,40
30,2,32,128,65536,0.00390625,335.3,192.2,1.744,8,128,8
31,1,32,128,65536,0.00390625,213.9,96.3,2.222,4,64,136
31,2,32,128,65536,0.00390625,441.6,185.6,2.38,4,64,64
32,1,32,128,65536,0.00390625,212.3,104.4,2.035,4,64,-1
32,2,32,128,65536,0.00390625,437.9,136.9,3.198,4,64,16
33,1,32,128,65536,0.00390625,228.3,87.1,2.621,8,128,64
33,2,32,128,65536,0.00390625,435.1,201.7,2.158,4,128,8
34,1,32,128,65536,0.00390625,234.2,102,2.296,8,64,40
34,2,32,128,65536,0.00390625,452.8,214.7,2.109,4,64,40
35,1,32,128,65536,0.00390625,239.4,92,2.603,4,64,80
35,2,32,128,65536,0.00390625,461,211.5,2.18,4,64,40
36,1,32,128,65536,0.00390625,230.4,113.7,2.027,8,64,-1
36,2,32,128,65536,0.00390625,451.5,226.5,1.994,4,64,-1
37,1,32,128,65536,0.00390625,241.2,97.8,2.466,4,64,112
37,2,32,128,65536,0.00390625,462.3,221.1,2.091,2,64,48
38,1,32,128,65536,0.00390625,242.7,111.3,2.18,8,128,40
38,2,32,128,65536,0.00390625,468,227.8,2.055,4,128,24
39,1,32,128,65536,0.00390625,240.7,113.6,2.119,4,64,80
39,2,32,128,65536,0.00390625,477,209.3,2.279,4,64,40
40,1,32,128,65536,0.00390625,243.3,128.4,1.895,8,64,-1
40,2,32,128,65536,0.00390625,477.4,175.4,2.721,4,64,40
41,1,32,128,65536,0.00390625,245.9,98.5,2.497,8,128,64
41,2,32,128,65536,0.00390625,482.7,223.4,2.161,8,128,24
42,1,32,128,65536,0.00390625,249.4,131.5,1.897,8,128,40
42,2,32,128,65536,0.00390625,487.2,257.4,1.893,2,64,40
43,1,32,128,65536,0.00390625,248.3,100.9,2.46,4,64,80
43,2,32,128,65536,0.00390625,496.4,233.6,2.125,2,64,40
44,1,32,128,65536,0.00390625,249.1,110.9,2.246,8,64,-1
44,2,32,128,65536,0.00390625,485.4,259.7,1.869,2,64,-1
45,1,32,128,65536,0.00390625,257.5,115.1,2.238,4,64,112
45,2,32,128,65536,0.00390625,505.5,242.7,2.083,8,64,-1
46,1,32,128,65536,0.00390625,271.9,130.4,2.085,8,128,40
46,2,32,128,65536,0.00390625,539.4,279.7,1.928,2,64,24
47,1,32,128,65536,0.00390625,280.2,141.8,1.975,8,128,8
47,2,32,128,65536,0.00390625,561.4,267.8,2.096,4,128,24
48,1,32,128,65536,0.00390625,276.8,150.4,1.841,8,64,16
48,2,32,128,65536,0.00390625,550.2,198.2,2.776,4,64,24
49,1,32,128,65536,0.00390625,299.6,124.2,2.413,8,128,64
49,2,32,128,65536,0.00390625,563.7,255,2.211,8,128,24
50,1,32,128,65536,0.00390625,294.3,149.8,1.965,4,128,24
50,2,32,128,65536,0.00390625,570.3,305,1.87,4,128,24
51,1,32,128,65536,0.00390625,299.5,130,2.305,4,64,80
51,2,32,128,65536,0.00390625,593.5,284,2.09,4,128,-1
52,1,32,128,65536,0.00390625,301,155,1.942,8,128,24
52,2,32,128,65536,0.00390625,588.8,328.3,1.793,2,64,-1
53,1,32,128,65536,0.00390625,307,146.1,2.101,8,128,64
53,2,32,128,65536,0.00390625,596.1,292.4,2.039,8,128,32
54,1,32,128,65536,0.00390625,304,136.3,2.23,4,64,40
54,2,32,128,65536,0.00390625,601.9,332,1.813,2,64,56
55,1,32,128,65536,0.00390625,319.8,148.4,2.154,4,64,16
55,2,32,128,65536,0.00390625,613.4,302.4,2.028,8,128,-1
56,1,32,128,65536,0.00390625,312.6,165.9,1.884,8,64,-1
56,2,32,128,65536,0.00390625,614.3,226.6,2.711,4,64,-1
57,1,32,128,65536,0.00390625,320.1,141.3,2.266,4,64,56
57,2,32,128,65536,0.00390625,613,297.3,2.062,4,128,-1
58,1,32,128,65536,0.00390625,307.5,163.9,1.876,8,128,32
58,2,32,128,65536,0.00390625,620,329.8,1.88,8,128,24
59,1,32,128,65536,0.00390625,325,142.9,2.274,4,64,80
59,2,32,128,65536,0.00390625,636,311.5,2.042,4,64,88
60,1,32,128,65536,0.00390625,321.1,177.5,1.81,4,128,-1
60,2,32,128,65536,0.00390625,615.2,314.4,1.957,2,64,-1
61,1,32,128,65536,0.00390625,424.1,171.2,2.477,8,128,72
61,2,32,128,65536,0.00390625,702.4,315.7,2.225,4,64,56
62,1,32,128,65536,0.00390625,417,161.4,2.583,4,64,40
62,2,32,128,65536,0.00390625,714.7,364.1,1.963,4,128,24
63,1,32,128,65536,0.00390625,436,191.2,2.28,8,256,4
63,2,32,128,65536,0.00390625,722.6,363.7,1.987,8,128,4
64,1,32,128,65536,0.00390625,432.3,208.7,2.072,4,64,-1
64,2,32,128,65536,0.00390625,724.2,270.9,2.674,4,64,8
65,1,32,128,65536,0.00390625,431.9,152.3,2.836,4,64,56
65,2,32,128,65536,0.00390625,724.9,312.6,2.319,8,128,32
66,1,32,128,65536,0.00390625,429.2,175.2,2.449,8,128,32
66,2,32,128,65536,0.00390625,727.7,371,1.962,2,64,16
67,1,32,128,65536,0.00390625,428.8,172,2.493,4,64,80
67,2,32,128,65536,0.00390625,725,360.1,2.013,4,64,88
68,1,32,128,65536,0.00390625,442.5,198.2,2.232,2,64,32
68,2,32,128,65536,0.00390625,746.8,357.9,2.086,4,128,8
69,1,32,128,65536,0.00390625,450.5,189.5,2.377,4,64,56
69,2,32,128,65536,0.00390625,757.6,386.5,1.96,8,128,32
70,1,32,128,65536,0.00390625,441.8,183.9,2.403,4,64,40
70,2,32,128,65536,0.00390625,757.2,413.7,1.83,2,64,40
71,1,32,128,65536,0.00390625,458.1,179,2.559,8,128,8
72,1,32,128,65536,0.00390625,453.9,224.8,2.019,4,64,-1
73,1,32,128,65536,0.00390625,454,179.7,2.526,4,64,56
73,2,32,128,65536,0.00390625,778,351.8,2.211,8,128,32
74,1,32,128,65536,0.00390625,453.4,202.9,2.235,8,128,24
74,2,32,128,65536,0.00390625,774.5,433.9,1.785,2,64,40
75,1,32,128,65536,0.00390625,458,187.3,2.445,8,128,24
75,2,32,128,65536,0.00390625,800.8,415.9,1.926,8,128,16
76,1,32,128,65536,0.00390625,456.5,216.3,2.11,4,64,32
77,1,32,128,65536,0.00390625,461.4,204.3,2.259,4,64,64
78,1,32,128,65536,0.00390625,446.7,207.1,2.157,4,64,112
79,1,32,128,65536,0.00390625,473.7,217.3,2.18,8,64,8
80,1,32,128,65536,0.00390625,472.4,242.5,1.948,2,64,-1
81,1,32,128,65536,0.00390625,474.3,209.5,2.264,4,64,56
82,1,32,128,65536,0.00390625,473.9,199.9,2.37,8,128,24
83,1,32,128,65536,0.00390625,475.7,227.3,2.093,8,64,-1
84,1,32,128,65536,0.00390625,474.1,254.6,1.862,8,64,-1
85,1,32,128,65536,0.00390625,482.7,226.7,2.129,8,128,72
86,1,32,128,65536,0.00390625,482,222.4,2.167,4,64,40
87,1,32,128,65536,0.00390625,498.3,232.2,2.146,8,64,8
88,1,32,128,65536,0.00390625,488.9,261.3,1.871,4,64,-1
89,1,32,128,65536,0.00390625,493.5,189,2.611,4,64,56
90,1,32,128,65536,0.00390625,474.6,218,2.177,8,128,32
91,1,32,128,65536,0.00390625,502.9,257.1,1.956,8,128,16
92,1,32,128,65536,0.00390625,539.7,284.1,1.899,8,64,40
93,1,32,128,65536,0.00390625,541.7,244.5,2.215,4,64,64
94,1,32,128,65536,0.00390625,539.1,273.3,1.972,4,64,-1
95,1,32,128,65536,0.00390625,561.4,241.7,2.323,8,64,8
96,1,32,128,65536,0.00390625,558.1,288.8,1.933,4,64,-1
97,1,32,128,65536,0.00390625,559.5,222.4,2.515,4,64,56
98,1,32,128,65536,0.00390625,549.2,226.4,2.426,8,128,32
99,1,32,128,65536,0.00390625,566.5,263.5,2.15,4,64,-1
100,1,32,128,65536,0.00390625,559.7,294,1.904,4,64,24
101,1,32,128,65536,0.00390625,565.4,277.7,2.036,8,128,40
102,1,32,128,65536,0.00390625,571.6,284.7,2.008,8,128,-1
103,1,32,128,65536,0.00390625,599.8,253.8,2.363,8,64,8
104,1,32,128,65536,0.00390625,586.6,328.7,1.785,2,64,-1
105,1,32,128,65536,0.00390625,585.5,260,2.252,4,64,56
106,1,32,128,65536,0.00390625,581,261.5,2.222,8,128,32
107,1,32,128,65536,0.00390625,599.9,271.1,2.213,4,64,-1
108,1,32,128,65536,0.00390625,591.8,318.3,1.859,8,128,40
109,1,32,128,65536,0.00390625,594.5,283.9,2.094,4,64,48
110,1,32,128,65536,0.00390625,587.7,290,2.026,4,64,80
111,1,32,128,65536,0.00390625,617.5,258.6,2.388,8,64,8
112,1,32,128,65536,0.00390625,603.2,351.3,1.717,2,64,-1
113,1,32,128,65536,0.00390625,609.2,253.1,2.407,4,64,56
114,1,32,128,65536,0.00390625,603.2,286,2.109,8,128,24
115,1,32,128,65536,0.00390625,624.5,292.8,2.133,2,64,-1
116,1,32,128,65536,0.00390625,613.1,314.9,1.947,8,128,16
117,1,32,128,65536,0.00390625,612.5,301.5,2.031,4,64,56
118,1,32,128,65536,0.00390625,609.5,284,2.146,8,128,4
119,1,32,128,65536,0.00390625,640.2,271.1,2.361,8,64,8
120,1,32,128,65536,0.00390625,623.9,380.4,1.64,2,64,-1
121,1,32,128,65536,0.00390625,621.8,259.1,2.399,4,64,56
122,1,32,128,65536,0.00390625,685,313.8,2.183,8,128,24
123,1,32,128,65536,0.00390625,706.7,336.5,2.1,4,64,8
124,1,32,128,65536,0.00390625,697.1,351.3,1.985,8,128,16
125,1,32,128,65536,0.00390625,702.3,357.4,1.965,4,64,80
126,1,32,128,65536,0.00390625,687.2,334.1,2.057,8,128,4
127,1,32,128,65536,0.00390625,726.7,306.7,2.37,8,64,8
128,1,32,128,65536,0.00390625,711.3,394.4,1.804,4,128,8