tune_results_ver3/logs_p8/tune_results.csv
batch_size,next_n,heads,index_dim,avg_kv_length,var_ratio,deepgemm_us,moreh_us,speedup,top_configs,num_warp,chunkK,splitK
1,1,32,128,65536,0.00390625,8.8,11.2,0.784,"[(2, 64, -1, 11), (8, 128, 512, 12), (8, 128, 476, 12), (8, 128, 334, 12), (8, 128, 332, 12), (8, 128, 298, 12), (8, 128, 412, 12), (4, 64, 704, 12), (8, 128, 510, 12), (8, 128, 410, 12)]",,,
1,2,32,128,65536,0.00390625,12.0,14.7,0.818,"[(4, 64, 410, 14), (4, 64, 362, 14), (4, 64, 404, 14), (4, 64, 360, 14), (4, 64, 418, 14), (4, 64, 366, 14), (4, 64, 412, 15), (8, 128, 446, 16), (8, 128, 280, 16), (4, 128, 172, 16)]",,,
2,1,32,128,65536,0.00390625,12.3,12.0,1.023,"[(8, 128, 364, 12), (8, 128, 328, 12), (8, 64, 280, 13), (8, 128, 140, 13), (8, 256, 254, 13), (8, 256, 184, 13), (8, 256, 242, 13), (8, 128, 142, 13), (8, 256, 186, 13), (8, 256, 144, 13)]",,,
2,2,32,128,65536,0.00390625,32.9,22.4,1.467,"[(4, 64, 170, 22), (4, 64, 130, 22), (4, 64, 178, 22), (4, 64, 176, 22), (4, 64, 184, 22), (4, 128, 166, 22), (4, 64, 124, 23), (4, 64, 126, 23), (2, 64, 324, 23), (2, 64, 328, 23)]",,,
3,1,32,128,65536,0.00390625,29.1,21.2,1.372,"[(2, 64, -1, 21), (8, 128, 478, 21), (8, 128, 480, 21), (8, 64, 448, 22), (8, 128, 476, 22), (8, 64, 446, 22), (8, 128, 240, 22), (4, 64, 308, 22), (8, 128, 202, 22), (8, 128, 176, 22)]",,,
3,2,32,128,65536,0.00390625,48.2,31.5,1.529,"[(4, 64, 284, 31), (2, 64, -1, 31), (2, 64, 166, 32), (4, 64, 154, 32), (4, 64, 140, 32), (4, 64, 132, 32), (4, 64, 142, 32), (4, 64, 90, 32), (8, 128, 98, 32), (8, 64, 94, 32)]",,,
4,1,32,128,65536,0.00390625,27.5,24.8,1.109,"[(2, 64, -1, 24), (4, 64, 152, 26), (8, 128, 474, 26), (8, 128, 164, 26), (8, 128, 142, 26), (8, 128, 178, 26), (4, 64, 148, 26), (4, 64, 214, 26), (8, 128, 176, 26), (8, 128, 218, 26)]",,,
4,2,32,128,65536,0.00390625,58.6,35.7,1.642,"[(4, 64, 126, 35), (4, 64, 158, 36), (4, 64, 160, 36), (4, 64, 156, 36), (4, 64, 154, 36), (8, 64, 116, 36), (4, 64, 310, 36), (2, 64, 148, 36), (4, 64, 306, 36), (4, 64, 276, 36)]",,,
5,1,32,128,65536,0.00390625,38.2,23.6,1.616,"[(8, 128, 106, 23), (8, 128, 98, 26), (8, 128, 92, 26), (8, 128, 96, 26), (8, 128, 100, 26), (8, 128, 124, 27), (8, 128, 110, 27), (2, 64, -1, 27), (8, 128, 114, 27), (8, 128, 118, 27)]",,,
5,2,32,128,65536,0.00390625,68.1,42.0,1.619,"[(8, 128, -1, 42), (4, 64, 58, 42), (8, 128, 58, 42), (8, 64, 58, 42), (4, 64, 60, 42), (8, 128, 62, 42), (8, 128, 60, 42), (8, 64, 60, 42), (8, 128, 64, 42), (4, 128, 64, 42)]",,,
6,1,32,128,65536,0.00390625,45.4,29.3,1.551,"[(8, 64, 94, 29), (8, 128, 86, 31), (8, 128, 98, 31), (8, 128, 96, 31), (2, 64, -1, 31), (2, 64, 138, 32), (4, 64, 152, 32), (4, 64, 90, 33), (4, 64, 98, 33), (8, 64, 494, 33)]",,,
6,2,32,128,65536,0.00390625,82.1,48.9,1.68,"[(8, 64, 70, 48), (8, 64, 72, 49), (8, 64, 68, 49), (2, 64, -1, 51), (8, 64, -1, 51), (4, 64, 66, 52), (4, 64, 78, 52), (4, 64, 48, 52), (4, 64, 70, 52), (8, 128, 44, 52)]",,,
7,1,32,128,65536,0.00390625,48.0,28.3,1.699,"[(8, 128, 36, 28), (8, 128, 38, 30), (8, 128, 44, 31), (8, 256, 34, 33), (4, 64, 146, 34), (8, 128, 242, 34), (8, 128, 228, 34), (8, 256, 38, 34), (8, 256, 40, 34), (8, 128, 234, 34)]",,,
7,2,32,128,65536,0.00390625,91.0,51.5,1.768,"[(4, 64, 58, 51), (4, 64, 70, 51), (4, 64, 60, 52), (8, 64, 58, 52), (2, 64, 60, 53), (8, 64, 60, 53), (2, 64, 58, 53), (4, 64, 292, 54), (4, 64, 334, 54), (4, 64, 240, 54)]",,,
8,1,32,128,65536,0.00390625,59.3,38.3,1.548,"[(2, 64, -1, 38), (8, 64, 50, 38), (8, 64, 76, 39), (4, 64, 74, 39), (4, 64, 76, 39), (4, 64, 96, 39), (4, 64, 72, 39), (4, 64, 98, 39), (8, 128, 70, 39), (8, 64, 72, 39)]",,,
8,2,32,128,65536,0.00390625,101.9,46.3,2.2,"[(8, 128, 36, 46), (8, 64, 38, 46), (8, 128, 32, 46), (8, 128, 38, 46), (4, 64, 58, 46), (4, 64, 62, 46), (8, 128, 34, 46), (8, 64, 58, 46), (4, 64, 74, 47), (4, 64, 76, 47)]",,,
9,1,32,128,65536,0.00390625,61.3,32.4,1.891,"[(8, 128, 60, 32), (8, 128, 58, 32), (8, 128, 62, 32), (8, 128, 64, 32), (4, 128, 58, 34), (4, 128, 64, 34), (4, 128, 62, 34), (4, 128, 60, 34), (8, 64, 60, 35), (8, 64, 58, 35)]",,,
9,2,32,128,65536,0.00390625,137.5,57.7,2.384,"[(8, 128, 30, 57), (4, 64, 52, 58), (4, 128, 30, 59), (8, 64, 34, 60), (4, 128, 24, 61), (8, 64, 52, 61), (4, 64, 34, 61), (2, 64, 52, 62), (8, 128, 24, 62), (4, 64, 328, 63)]",,,
10,1,32,128,65536,0.00390625,62.8,39.4,1.595,"[(4, 64, 78, 39), (8, 128, 30, 39), (4, 64, 74, 39), (8, 128, 54, 39), (4, 64, 76, 40), (8, 128, 56, 40), (8, 256, 32, 40), (8, 64, 74, 40), (8, 128, 52, 40), (8, 64, 76, 40)]",,,
10,2,32,128,65536,0.00390625,113.0,65.3,1.731,"[(4, 128, 30, 65), (8, 128, -1, 67), (8, 128, 30, 67), (4, 64, 40, 68), (4, 128, -1, 68), (4, 64, 46, 70), (2, 64, 58, 70), (8, 64, 40, 70), (2, 64, 60, 70), (2, 64, 52, 70)]",,,
11,1,32,128,65536,0.00390625,73.9,38.4,1.923,"[(4, 64, 80, 38), (4, 64, 84, 38), (4, 64, 82, 38), (8, 64, 80, 39), (8, 64, 82, 39), (8, 64, 84, 39), (2, 64, 82, 40), (2, 64, 84, 40), (2, 64, 80, 40), (4, 64, 182, 40)]",,,
11,2,32,128,65536,0.00390625,166.3,66.0,2.518,"[(4, 64, 40, 66), (8, 64, 40, 67), (4, 64, 46, 69), (4, 64, 34, 71), (2, 64, 46, 71), (8, 64, 34, 72), (8, 64, 46, 72), (2, 64, 40, 73), (4, 64, 80, 73), (8, 128, 42, 74)]",,,
12,1,32,128,65536,0.00390625,83.2,49.2,1.69,"[(2, 64, 102, 49), (2, 64, 94, 49), (2, 64, 98, 49), (2, 64, 96, 49), (2, 64, 88, 49), (8, 128, 44, 50), (4, 64, 78, 51), (8, 64, 44, 51), (4, 64, -1, 51), (4, 64, 74, 51)]",,,
12,2,32,128,65536,0.00390625,167.8,85.0,1.973,"[(4, 64, 34, 85), (2, 64, 34, 85), (2, 64, 38, 85), (8, 64, 24, 86), (4, 64, 36, 86), (2, 64, 32, 86), (4, 64, 32, 86), (4, 64, 24, 87), (8, 64, 36, 87), (2, 64, 36, 87)]",,,
13,1,32,128,65536,0.00390625,83.9,45.8,1.831,"[(4, 64, 58, 45), (4, 64, 60, 45), (8, 128, 124, 46), (8, 64, 60, 46), (8, 64, 58, 46), (8, 128, 110, 47), (8, 128, 108, 47), (8, 128, 126, 47), (8, 128, 104, 47), (8, 128, 122, 47)]",,,
13,2,32,128,65536,0.00390625,175.2,78.4,2.235,"[(4, 64, 46, 78), (4, 64, 76, 78), (4, 64, 78, 78), (4, 64, 74, 80), (2, 64, 46, 80), (8, 64, 78, 80), (8, 64, 46, 81), (8, 64, 74, 81), (8, 64, 76, 82), (8, 128, 64, 83)]",,,
14,1,32,128,65536,0.00390625,88.5,44.6,1.985,"[(8, 128, 40, 44), (8, 128, 42, 46), (8, 64, 40, 47), (4, 128, 40, 47), (4, 128, 42, 47), (4, 64, 40, 47), (4, 64, 64, 47), (8, 64, 64, 49), (4, 64, 62, 49), (8, 64, 62, 51)]",,,
14,2,32,128,65536,0.00390625,169.9,89.5,1.899,"[(4, 64, 30, 89), (8, 64, 30, 92), (8, 128, 36, 93), (4, 128, 36, 93), (8, 128, 42, 93), (4, 64, 90, 94), (8, 128, 40, 94), (4, 64, 88, 94), (4, 64, 70, 95), (4, 64, 26, 95)]",,,
15,1,32,128,65536,0.00390625,95.7,40.6,2.356,"[(8, 128, 36, 40), (4, 64, 82, 44), (8, 64, 82, 46), (4, 64, 80, 46), (4, 64, 84, 46), (4, 128, 36, 46), (8, 128, 34, 47), (2, 64, 80, 47), (2, 64, 82, 47), (2, 64, 84, 48)]",,,
15,2,32,128,65536,0.00390625,174.4,93.1,1.872,"[(8, 128, 40, 93), (8, 128, 42, 93), (4, 64, 24, 94), (8, 128, 64, 94), (8, 64, 24, 95), (8, 128, 62, 96), (4, 64, 68, 96), (8, 128, 60, 96), (8, 128, 58, 96), (4, 64, 66, 96)]",,,
16,1,32,128,65536,0.00390625,100.2,61.3,1.634,"[(4, 64, 36, 61), (4, 64, 46, 62), (8, 64, 56, 62), (4, 64, 38, 62), (8, 64, 50, 63), (4, 64, 52, 63), (8, 64, 36, 63), (8, 128, 32, 63), (8, 64, 48, 63), (4, 64, 50, 63)]",,,
16,2,32,128,65536,0.00390625,214.9,73.5,2.926,"[(4, 64, 36, 73), (8, 64, 36, 73), (4, 64, 38, 73), (4, 64, 34, 75), (8, 64, 38, 76), (4, 64, 30, 77), (4, 64, 32, 77), (8, 64, 28, 77), (8, 64, 34, 77), (8, 64, 30, 77)]",,,
